    1   0.000000 2a02:2788:484:962:1ccf:db50:51f:eb26 → 2606:4700::6810:8ee4 TCP 94 49522 → 443 [SYN] Seq=0 Win=28800 Len=0 MSS=1440 SACK_PERM=1 TSval=2057822476 TSecr=0 WS=128
    2   0.020881 2606:4700::6810:8ee4 → 2a02:2788:484:962:1ccf:db50:51f:eb26 TCP 86 443 → 49522 [SYN, ACK] Seq=0 Ack=1 Win=27200 Len=0 MSS=1360 SACK_PERM=1 WS=1024
    3   0.020945 2a02:2788:484:962:1ccf:db50:51f:eb26 → 2606:4700::6810:8ee4 TCP 74 49522 → 443 [ACK] Seq=1 Ack=1 Win=28800 Len=0
    4   0.036676 2a02:2788:484:962:1ccf:db50:51f:eb26 → 2606:4700::6810:8ee4 TLSv1 331 Client Hello
    5   0.061020 2606:4700::6810:8ee4 → 2a02:2788:484:962:1ccf:db50:51f:eb26 TCP 74 443 → 49522 [ACK] Seq=1 Ack=258 Win=28672 Len=0
    6   0.066333 2606:4700::6810:8ee4 → 2a02:2788:484:962:1ccf:db50:51f:eb26 TLSv1.3 1434 Server Hello, Change Cipher Spec
    7   0.066366 2a02:2788:484:962:1ccf:db50:51f:eb26 → 2606:4700::6810:8ee4 TCP 74 49522 → 443 [ACK] Seq=258 Ack=1361 Win=31744 Len=0
    8   0.067367 2606:4700::6810:8ee4 → 2a02:2788:484:962:1ccf:db50:51f:eb26 TCP 1434 443 → 49522 [ACK] Seq=1361 Ack=258 Win=28672 Len=1360 [TCP segment of a reassembled PDU]
    9   0.067403 2a02:2788:484:962:1ccf:db50:51f:eb26 → 2606:4700::6810:8ee4 TCP 74 49522 → 443 [ACK] Seq=258 Ack=2721 Win=34560 Len=0
   10   0.067428 2606:4700::6810:8ee4 → 2a02:2788:484:962:1ccf:db50:51f:eb26 TLSv1.3 636 Application Data
   11   0.067436 2a02:2788:484:962:1ccf:db50:51f:eb26 → 2606:4700::6810:8ee4 TCP 74 49522 → 443 [ACK] Seq=258 Ack=3283 Win=37376 Len=0
   12   0.068855 2a02:2788:484:962:1ccf:db50:51f:eb26 → 2606:4700::6810:8ee4 TLSv1.3 154 Change Cipher Spec, Application Data
   13   0.069073 2a02:2788:484:962:1ccf:db50:51f:eb26 → 2606:4700::6810:8ee4 TLSv1.3 120 Application Data
   14   0.069109 2a02:2788:484:962:1ccf:db50:51f:eb26 → 2606:4700::6810:8ee4 TLSv1.3 123 Application Data
   15   0.069136 2a02:2788:484:962:1ccf:db50:51f:eb26 → 2606:4700::6810:8ee4 TLSv1.3 109 Application Data
   16   0.069203 2a02:2788:484:962:1ccf:db50:51f:eb26 → 2606:4700::6810:8ee4 TLSv1.3 137 Application Data
   17   0.091087 2606:4700::6810:8ee4 → 2a02:2788:484:962:1ccf:db50:51f:eb26 TCP 74 443 → 49522 [ACK] Seq=3283 Ack=531 Win=28672 Len=0
   18   0.091167 2606:4700::6810:8ee4 → 2a02:2788:484:962:1ccf:db50:51f:eb26 TLSv1.3 627 Application Data, Application Data
   19   0.091457 2a02:2788:484:962:1ccf:db50:51f:eb26 → 2606:4700::6810:8ee4 TLSv1.3 105 Application Data
   20   0.096926 2606:4700::6810:8ee4 → 2a02:2788:484:962:1ccf:db50:51f:eb26 TLSv1.3 393 Application Data
   21   0.097295 2a02:2788:484:962:1ccf:db50:51f:eb26 → 2606:4700::6810:8ee4 TLSv1.3 98 Application Data
   22   0.098829 2a02:2788:484:962:1ccf:db50:51f:eb26 → 2606:4700::6810:8ee4 TCP 74 49522 → 443 [FIN, ACK] Seq=586 Ack=4155 Win=42752 Len=0
   23   0.121412 2606:4700::6810:8ee4 → 2a02:2788:484:962:1ccf:db50:51f:eb26 TCP 74 443 → 49522 [ACK] Seq=4155 Ack=586 Win=28672 Len=0
   24   0.121445 2606:4700::6810:8ee4 → 2a02:2788:484:962:1ccf:db50:51f:eb26 TCP 74 443 → 49522 [FIN, ACK] Seq=4155 Ack=586 Win=28672 Len=0
   25   0.121465 2a02:2788:484:962:1ccf:db50:51f:eb26 → 2606:4700::6810:8ee4 TCP 74 49522 → 443 [ACK] Seq=587 Ack=4156 Win=42752 Len=0
   26   0.122879 2606:4700::6810:8ee4 → 2a02:2788:484:962:1ccf:db50:51f:eb26 TCP 74 443 → 49522 [ACK] Seq=4156 Ack=587 Win=28672 Len=0
